{
  "$schema": "https://lumen.skyline23.com/schemas/contract-v1.json",
  "schemaVersion": 1,
  "identity": {
    "name": "lumen-stream",
    "version": 4,
    "package": "lumen.streaming.v4",
    "alpn": "lumen-stream/4"
  },
  "protobuf": {
    "syntax": "proto3",
    "package": "lumen.streaming.v4",
    "source": "syntax = \"proto3\";\n\npackage lumen.streaming.v4;\n\n// Transport authority: TLS 1.3 QUIC with ALPN lumen-stream/4. Session control,\n// reliable input, telemetry, codec configuration, and video bootstrap records\n// use length-delimited protobuf streams. Video deltas, audio objects, and input\n// motion use QUIC DATAGRAM payloads with the separate compact native header.\n\nenum VideoCodec {\n  VIDEO_CODEC_UNSPECIFIED = 0;\n  VIDEO_CODEC_H264 = 1;\n  VIDEO_CODEC_HEVC = 2;\n  VIDEO_CODEC_AV1 = 3;\n  VIDEO_CODEC_SHADOW_VC = 4;\n}\n\nenum DynamicRange {\n  DYNAMIC_RANGE_UNSPECIFIED = 0;\n  DYNAMIC_RANGE_SDR = 1;\n  DYNAMIC_RANGE_HDR10 = 2;\n}\n\nenum VideoProfile {\n  VIDEO_PROFILE_UNSPECIFIED = 0;\n  VIDEO_PROFILE_H264_MAIN = 1;\n  VIDEO_PROFILE_H264_HIGH = 2;\n  VIDEO_PROFILE_H264_HIGH_444_PREDICTIVE = 3;\n  VIDEO_PROFILE_HEVC_MAIN = 4;\n  VIDEO_PROFILE_HEVC_MAIN10 = 5;\n  VIDEO_PROFILE_HEVC_MAIN_444 = 6;\n  VIDEO_PROFILE_HEVC_MAIN_444_10 = 7;\n  VIDEO_PROFILE_AV1_MAIN = 8;\n  // Independent SCV1 frames, q52 FC3 SpatialBase16V1, SDR BT.709 limited P010.\n  VIDEO_PROFILE_SHADOW_VC_SPATIAL_BASE16 = 9;\n}\n\nenum ChromaSubsampling {\n  CHROMA_SUBSAMPLING_UNSPECIFIED = 0;\n  CHROMA_SUBSAMPLING_YUV420 = 1;\n  CHROMA_SUBSAMPLING_YUV444 = 2;\n}\n\nenum ColorRange {\n  COLOR_RANGE_UNSPECIFIED = 0;\n  COLOR_RANGE_LIMITED = 1;\n  COLOR_RANGE_FULL = 2;\n}\n\nenum AudioChannelMode {\n  AUDIO_CHANNEL_MODE_UNSPECIFIED = 0;\n  AUDIO_CHANNEL_MODE_STEREO = 1;\n  AUDIO_CHANNEL_MODE_SURROUND_5_1 = 2;\n  AUDIO_CHANNEL_MODE_SURROUND_7_1 = 3;\n}\n\nenum AudioQuality {\n  AUDIO_QUALITY_UNSPECIFIED = 0;\n  AUDIO_QUALITY_STANDARD = 1;\n  AUDIO_QUALITY_HIGH = 2;\n}\n\nenum NegotiationFailure {\n  NEGOTIATION_FAILURE_UNSPECIFIED = 0;\n  NEGOTIATION_FAILURE_UNSUPPORTED_PROTOCOL_VERSION = 1;\n  reserved 2;\n  NEGOTIATION_FAILURE_INVALID_SESSION_EPOCH = 3;\n  NEGOTIATION_FAILURE_INVALID_DISPLAY_MODE = 4;\n  NEGOTIATION_FAILURE_INVALID_PRESENTATION_CONTRACT = 5;\n  NEGOTIATION_FAILURE_INVALID_VIDEO_CODEC = 6;\n  NEGOTIATION_FAILURE_UNSUPPORTED_VIDEO_SELECTION = 7;\n  NEGOTIATION_FAILURE_INVALID_DYNAMIC_RANGE = 8;\n  NEGOTIATION_FAILURE_INVALID_POLICY_MODE = 9;\n  NEGOTIATION_FAILURE_DATAGRAM_PAYLOAD_TOO_SMALL = 10;\n  NEGOTIATION_FAILURE_INVALID_RECEIVE_MEMORY = 11;\n  NEGOTIATION_FAILURE_UNSUPPORTED_AUDIO_LAYOUT = 12;\n  NEGOTIATION_FAILURE_INVALID_AUDIO_QUALITY = 13;\n  NEGOTIATION_FAILURE_INVALID_STREAMING_PROFILE_REVISION = 14;\n  NEGOTIATION_FAILURE_UNSUPPORTED_MEDIA_CAPABILITIES = 15;\n}\n\nenum PolicyMode {\n  POLICY_MODE_UNSPECIFIED = 0;\n  POLICY_MODE_ULTRA_LATENCY = 1;\n  POLICY_MODE_BALANCED = 2;\n  POLICY_MODE_QUALITY = 3;\n}\n\nenum DisplayGamut {\n  DISPLAY_GAMUT_UNSPECIFIED = 0;\n  DISPLAY_GAMUT_SRGB = 1;\n  DISPLAY_GAMUT_DISPLAY_P3 = 2;\n  DISPLAY_GAMUT_REC2020 = 3;\n}\n\nenum DisplayTransfer {\n  DISPLAY_TRANSFER_UNSPECIFIED = 0;\n  DISPLAY_TRANSFER_SDR = 1;\n  DISPLAY_TRANSFER_PQ = 2;\n  DISPLAY_TRANSFER_HLG = 3;\n}\n\nenum PointerMotionMode {\n  POINTER_MOTION_MODE_UNSPECIFIED = 0;\n  POINTER_MOTION_MODE_RELATIVE = 1;\n  POINTER_MOTION_MODE_ABSOLUTE = 2;\n}\n\nenum ContactPhase {\n  CONTACT_PHASE_UNSPECIFIED = 0;\n  CONTACT_PHASE_BEGAN = 1;\n  CONTACT_PHASE_ENDED = 2;\n  CONTACT_PHASE_CANCELLED = 3;\n}\n\nenum GamepadButton {\n  GAMEPAD_BUTTON_UNSPECIFIED = 0;\n  GAMEPAD_BUTTON_SOUTH = 1;\n  GAMEPAD_BUTTON_EAST = 2;\n  GAMEPAD_BUTTON_WEST = 3;\n  GAMEPAD_BUTTON_NORTH = 4;\n  GAMEPAD_BUTTON_LEFT_BUMPER = 5;\n  GAMEPAD_BUTTON_RIGHT_BUMPER = 6;\n  GAMEPAD_BUTTON_LEFT_STICK = 7;\n  GAMEPAD_BUTTON_RIGHT_STICK = 8;\n  GAMEPAD_BUTTON_BACK = 9;\n  GAMEPAD_BUTTON_START = 10;\n  GAMEPAD_BUTTON_GUIDE = 11;\n  GAMEPAD_BUTTON_DPAD_UP = 12;\n  GAMEPAD_BUTTON_DPAD_DOWN = 13;\n  GAMEPAD_BUTTON_DPAD_LEFT = 14;\n  GAMEPAD_BUTTON_DPAD_RIGHT = 15;\n}\n\nmessage VideoFormat {\n  VideoCodec codec = 1;\n  VideoProfile profile = 2;\n  ChromaSubsampling chroma_subsampling = 3;\n  uint32 bit_depth = 4;\n  DynamicRange dynamic_range = 5;\n  ColorRange color_range = 6;\n}\n\nmessage VideoCapability {\n  reserved 1, 2, 3, 4, 5, 6;\n  VideoFormat format = 7;\n  uint32 max_width = 8;\n  uint32 max_height = 9;\n  uint32 max_refresh_millihz = 10;\n  optional bool hardware_accelerated = 11;\n}\n\nmessage ClientSessionHello {\n  uint32 minimum_protocol_version = 1;\n  uint32 maximum_protocol_version = 2;\n  reserved 3;\n  uint32 width = 4;\n  uint32 height = 5;\n  uint32 refresh_millihz = 6;\n  repeated VideoCapability video_capabilities = 7;\n  reserved 8;\n  PolicyMode requested_policy = 9;\n  uint32 maximum_datagram_payload = 10;\n  uint64 receive_memory_bytes = 11;\n  repeated uint32 opus_channel_counts = 12;\n  reserved 13;\n  string device_id = 14;\n  string access_token = 15;\n  uint32 application_id = 16;\n  bool resume = 17;\n  uint32 bitrate_kbps = 18;\n  bool play_audio_on_host = 19;\n  bool virtual_display = 20;\n  bool sink_hidpi = 21;\n  bool sink_scale_explicit = 22;\n  bool sink_mode_is_logical = 23;\n  uint32 sink_scale_percent = 24;\n  DisplayGamut sink_gamut = 25;\n  DisplayTransfer sink_transfer = 26;\n  float sink_current_edr_headroom = 27;\n  float sink_potential_edr_headroom = 28;\n  uint32 sink_current_peak_luminance_nits = 29;\n  uint32 sink_potential_peak_luminance_nits = 30;\n  bool sink_supports_frame_gated_hdr = 31;\n  bool sink_supports_hdr_tile_overlay = 32;\n  bool sink_supports_per_frame_hdr_metadata = 33;\n  AudioQuality requested_audio_quality = 34;\n  AudioChannelMode requested_audio_channel_mode = 35;\n  uint64 streaming_profile_revision = 36;\n  VideoFormat requested_video_format = 37;\n  uint64 media_capabilities = 38;\n}\n\nmessage HostSessionPlan {\n  uint32 protocol_version = 1;\n  uint32 session_epoch = 2;\n  reserved 3;\n  uint32 encoded_width = 4;\n  uint32 encoded_height = 5;\n  uint32 refresh_millihz = 6;\n  reserved 7, 8, 9;\n  PolicyMode policy = 10;\n  uint32 maximum_datagram_payload = 11;\n  uint32 maximum_presentable_frames = 12;\n  reserved 13;\n  uint32 policy_revision = 14;\n  uint32 opus_channel_count = 15;\n  uint32 opus_packet_duration_microseconds = 16;\n  uint32 bitrate_kbps = 17;\n  uint32 sink_scale_percent = 18;\n  DisplayGamut sink_gamut = 19;\n  DisplayTransfer sink_transfer = 20;\n  float sink_current_edr_headroom = 21;\n  float sink_potential_edr_headroom = 22;\n  uint32 sink_current_peak_luminance_nits = 23;\n  uint32 sink_potential_peak_luminance_nits = 24;\n  bool sink_supports_frame_gated_hdr = 25;\n  bool sink_supports_hdr_tile_overlay = 26;\n  bool sink_supports_per_frame_hdr_metadata = 27;\n  bool enhanced_audio_quality = 28;\n  uint32 dynamic_range_transport = 29;\n  bool sink_hidpi = 30;\n  bool sink_scale_explicit = 31;\n  bool sink_mode_is_logical = 32;\n  uint64 streaming_profile_revision = 33;\n  uint32 opus_stream_count = 34;\n  uint32 opus_coupled_stream_count = 35;\n  bytes opus_mapping = 36;\n  uint32 video_stream_id = 37;\n  uint32 audio_stream_id = 38;\n  uint32 input_motion_stream_id = 39;\n  uint32 video_configuration_id = 40;\n  uint32 maximum_data_shards = 41;\n  uint32 maximum_parity_shards = 42;\n  uint32 initial_parity_percentage = 43;\n  VideoCapability selected_video_capability = 44;\n  uint32 maximum_object_delay_us = 45;\n  uint64 media_capabilities = 46;\n}\n\nmessage CodecConfiguration {\n  uint32 session_epoch = 1;\n  uint32 stream_id = 2;\n  uint32 configuration_id = 3;\n  VideoCodec codec = 4;\n  // SHADOW_VC: bounded (1024 byte) UTF-8 JSON with version=1, model, checkpoint,\n  // width and height matching the selected mode. The immutable model is\n  // fc3-spatial-base16-v1; checkpoint SHA256 is\n  // f8db4b2ec5c1a63ab4d9bb1c1fda16901769e8afe31793fdd4adcfa81a7f0ce2.\n  // Dimensions must be even, 2..3840 by 2..2160. No in-band scaling.\n  bytes decoder_configuration_record = 5;\n}\n\nmessage CodecConfigurationAck {\n  uint32 session_epoch = 1;\n  uint32 stream_id = 2;\n  uint32 configuration_id = 3;\n}\n\nenum VideoKeyframeRequestReason {\n  VIDEO_KEYFRAME_REQUEST_REASON_UNSPECIFIED = 0;\n  VIDEO_KEYFRAME_REQUEST_REASON_INCOMPLETE_UNIT = 1;\n  VIDEO_KEYFRAME_REQUEST_REASON_DECODER_RECOVERY = 2;\n}\n\nmessage VideoKeyframeRequest {\n  uint32 session_epoch = 1;\n  uint32 stream_id = 2;\n  uint32 after_frame_id = 3;\n  VideoKeyframeRequestReason reason = 4;\n  uint32 generation_id = 5;\n}\n\nenum VideoBootstrapReason {\n  VIDEO_BOOTSTRAP_REASON_UNSPECIFIED = 0;\n  VIDEO_BOOTSTRAP_REASON_INITIAL = 1;\n  VIDEO_BOOTSTRAP_REASON_PERIODIC = 2;\n  VIDEO_BOOTSTRAP_REASON_REPAIR = 3;\n  VIDEO_BOOTSTRAP_REASON_CONFIGURATION_CHANGE = 4;\n}\n\nmessage VideoBootstrap {\n  uint32 session_epoch = 1;\n  uint32 stream_id = 2;\n  uint32 configuration_id = 3;\n  uint32 generation_id = 4;\n  uint32 frame_id = 5;\n  uint32 capture_timestamp_us = 6;\n  VideoBootstrapReason reason = 7;\n  bytes access_unit = 8;\n}\n\nenum VideoBootstrapResultCode {\n  VIDEO_BOOTSTRAP_RESULT_CODE_UNSPECIFIED = 0;\n  VIDEO_BOOTSTRAP_RESULT_CODE_DECODED = 1;\n  VIDEO_BOOTSTRAP_RESULT_CODE_DECODER_REJECTED = 2;\n  VIDEO_BOOTSTRAP_RESULT_CODE_STALE = 3;\n}\n\nmessage VideoBootstrapResult {\n  uint32 session_epoch = 1;\n  uint32 stream_id = 2;\n  uint32 configuration_id = 3;\n  uint32 generation_id = 4;\n  uint32 frame_id = 5;\n  VideoBootstrapResultCode result = 6;\n  string message = 7;\n}\n\nmessage MediaFeedback {\n  uint32 stream_id = 1;\n  uint32 highest_datagram_sequence = 2;\n  uint32 received_datagrams = 3;\n  uint32 recovered_shards = 4;\n  uint32 unrecoverable_objects = 5;\n  uint32 late_objects = 6;\n  uint32 reordered_datagrams = 7;\n  uint32 estimated_jitter_us = 8;\n  uint32 decoder_queue_depth = 9;\n  uint32 presentation_drops = 10;\n  uint32 window_milliseconds = 11;\n  u